{"$schema":"./curve.schema.json","schemaVersion":1,"engineVersion":1,"amountEncoding":"uint256-decimal-string","parameters":{"totalSupply":"1000000000000000000000000000","curveTokens":"800000000000000000000000000","lpTokens":"200000000000000000000000000","graduationEth":"4200000000000000000","initialVirtualEth":"1400000000000000000","initialVirtualToken":"1066666666666666666666666667","tradeFeeBps":100,"protocolShareBps":5000},"cases":[{"id":"buy_normal","operation":"buy","initialState":{"phase":"curve","virtualEth":"1400000000000000000","virtualToken":"1066666666666666666666666667","tokensSold":"0","realCurveEth":"0","protocolFees":"0","creatorFees":"0"},"input":{"ethGross":"1000000000000000000","tokensIn":"0"},"output":{"ethGross":"1000000000000000000","ethRefund":"0","ethOut":"0","tokenAmount":"441841004184100418410041841","protocolFee":"5000000000000000","creatorFee":"5000000000000000","graduates":false},"nextState":{"phase":"curve","virtualEth":"2390000000000000000","virtualToken":"624825662482566248256624826","tokensSold":"441841004184100418410041841","realCurveEth":"990000000000000000","protocolFees":"5000000000000000","creatorFees":"5000000000000000"},"expectedRevert":null},{"id":"buy_one_wei","operation":"buy","initialState":{"phase":"curve","virtualEth":"1400000000000000000","virtualToken":"1066666666666666666666666667","tokensSold":"0","realCurveEth":"0","protocolFees":"0","creatorFees":"0"},"input":{"ethGross":"1","tokensIn":"0"},"output":{"ethGross":"1","ethRefund":"0","ethOut":"0","tokenAmount":"761904761","protocolFee":"0","creatorFee":"0","graduates":false},"nextState":{"phase":"curve","virtualEth":"1400000000000000001","virtualToken":"1066666666666666665904761906","tokensSold":"761904761","realCurveEth":"1","protocolFees":"0","creatorFees":"0"},"expectedRevert":null},{"id":"buy_fee_split_dust","operation":"buy","initialState":{"phase":"curve","virtualEth":"1400000000000000000","virtualToken":"1066666666666666666666666667","tokensSold":"0","realCurveEth":"0","protocolFees":"0","creatorFees":"0"},"input":{"ethGross":"100","tokensIn":"0"},"output":{"ethGross":"100","ethRefund":"0","ethOut":"0","tokenAmount":"75428571428","protocolFee":"0","creatorFee":"1","graduates":false},"nextState":{"phase":"curve","virtualEth":"1400000000000000099","virtualToken":"1066666666666666591238095239","tokensSold":"75428571428","realCurveEth":"99","protocolFees":"0","creatorFees":"1"},"expectedRevert":null},{"id":"buy_mid_curve","operation":"buy","initialState":{"phase":"curve","virtualEth":"2390000000000000000","virtualToken":"624825662482566248256624826","tokensSold":"441841004184100418410041841","realCurveEth":"990000000000000000","protocolFees":"5000000000000000","creatorFees":"5000000000000000"},"input":{"ethGross":"500000000000000000","tokensIn":"0"},"output":{"ethGross":"500000000000000000","ethRefund":"0","ethOut":"0","tokenAmount":"107205789576731470671413965","protocolFee":"2500000000000000","creatorFee":"2500000000000000","graduates":false},"nextState":{"phase":"curve","virtualEth":"2885000000000000000","virtualToken":"517619872905834777585210861","tokensSold":"549046793760831889081455806","realCurveEth":"1485000000000000000","protocolFees":"7500000000000000","creatorFees":"7500000000000000"},"expectedRevert":null},{"id":"buy_just_below_graduation","operation":"buy","initialState":{"phase":"curve","virtualEth":"1400000000000000000","virtualToken":"1066666666666666666666666667","tokensSold":"0","realCurveEth":"0","protocolFees":"0","creatorFees":"0"},"input":{"ethGross":"4242424242424242423","tokensIn":"0"},"output":{"ethGross":"4242424242424242423","ethRefund":"0","ethOut":"0","tokenAmount":"799999999999999999952380952","protocolFee":"21212121212121212","creatorFee":"21212121212121212","graduates":false},"nextState":{"phase":"curve","virtualEth":"5599999999999999999","virtualToken":"266666666666666666714285715","tokensSold":"799999999999999999952380952","realCurveEth":"4199999999999999999","protocolFees":"21212121212121212","creatorFees":"21212121212121212"},"expectedRevert":null},{"id":"buy_final_exact","operation":"buy","initialState":{"phase":"curve","virtualEth":"1400000000000000000","virtualToken":"1066666666666666666666666667","tokensSold":"0","realCurveEth":"0","protocolFees":"0","creatorFees":"0"},"input":{"ethGross":"4242424242424242424","tokensIn":"0"},"output":{"ethGross":"4242424242424242424","ethRefund":"0","ethOut":"0","tokenAmount":"800000000000000000000000000","protocolFee":"21212121212121212","creatorFee":"21212121212121212","graduates":true},"nextState":{"phase":"graduated","virtualEth":"5600000000000000000","virtualToken":"266666666666666666666666667","tokensSold":"800000000000000000000000000","realCurveEth":"4200000000000000000","protocolFees":"21212121212121212","creatorFees":"21212121212121212"},"expectedRevert":null},{"id":"buy_final_refund_and_graduation","operation":"buy","initialState":{"phase":"curve","virtualEth":"1400000000000000000","virtualToken":"1066666666666666666666666667","tokensSold":"0","realCurveEth":"0","protocolFees":"0","creatorFees":"0"},"input":{"ethGross":"10000000000000000000","tokensIn":"0"},"output":{"ethGross":"4242424242424242424","ethRefund":"5757575757575757576","ethOut":"0","tokenAmount":"800000000000000000000000000","protocolFee":"21212121212121212","creatorFee":"21212121212121212","graduates":true},"nextState":{"phase":"graduated","virtualEth":"5600000000000000000","virtualToken":"266666666666666666666666667","tokensSold":"800000000000000000000000000","realCurveEth":"4200000000000000000","protocolFees":"21212121212121212","creatorFees":"21212121212121212"},"expectedRevert":null},{"id":"sell_normal","operation":"sell","initialState":{"phase":"curve","virtualEth":"2390000000000000000","virtualToken":"624825662482566248256624826","tokensSold":"441841004184100418410041841","realCurveEth":"990000000000000000","protocolFees":"5000000000000000","creatorFees":"5000000000000000"},"input":{"ethGross":"0","tokensIn":"220920502092050209205020920"},"output":{"ethGross":"624300791556728232","ethRefund":"0","ethOut":"618057783641160950","tokenAmount":"220920502092050209205020920","protocolFee":"3121503957783641","creatorFee":"3121503957783641","graduates":false},"nextState":{"phase":"curve","virtualEth":"1765699208443271768","virtualToken":"845746164574616457461645746","tokensSold":"220920502092050209205020921","realCurveEth":"365699208443271768","protocolFees":"8121503957783641","creatorFees":"8121503957783641"},"expectedRevert":null},{"id":"sell_full","operation":"sell","initialState":{"phase":"curve","virtualEth":"2390000000000000000","virtualToken":"624825662482566248256624826","tokensSold":"441841004184100418410041841","realCurveEth":"990000000000000000","protocolFees":"5000000000000000","creatorFees":"5000000000000000"},"input":{"ethGross":"0","tokensIn":"441841004184100418410041841"},"output":{"ethGross":"990000000000000000","ethRefund":"0","ethOut":"980100000000000000","tokenAmount":"441841004184100418410041841","protocolFee":"4950000000000000","creatorFee":"4950000000000000","graduates":false},"nextState":{"phase":"curve","virtualEth":"1400000000000000000","virtualToken":"1066666666666666666666666667","tokensSold":"0","realCurveEth":"0","protocolFees":"9950000000000000","creatorFees":"9950000000000000"},"expectedRevert":null},{"id":"invalid_buy_zero_input","operation":"buy","initialState":{"phase":"curve","virtualEth":"1400000000000000000","virtualToken":"1066666666666666666666666667","tokensSold":"0","realCurveEth":"0","protocolFees":"0","creatorFees":"0"},"input":{"ethGross":"0","tokensIn":"0"},"output":null,"nextState":{"phase":"curve","virtualEth":"1400000000000000000","virtualToken":"1066666666666666666666666667","tokensSold":"0","realCurveEth":"0","protocolFees":"0","creatorFees":"0"},"expectedRevert":{"name":"ZeroInput","data":"0xaf458c07"}},{"id":"invalid_sell_zero_input","operation":"sell","initialState":{"phase":"curve","virtualEth":"1400000000000000000","virtualToken":"1066666666666666666666666667","tokensSold":"0","realCurveEth":"0","protocolFees":"0","creatorFees":"0"},"input":{"ethGross":"0","tokensIn":"0"},"output":null,"nextState":{"phase":"curve","virtualEth":"1400000000000000000","virtualToken":"1066666666666666666666666667","tokensSold":"0","realCurveEth":"0","protocolFees":"0","creatorFees":"0"},"expectedRevert":{"name":"ZeroInput","data":"0xaf458c07"}},{"id":"invalid_sell_oversell","operation":"sell","initialState":{"phase":"curve","virtualEth":"1400000000000000000","virtualToken":"1066666666666666666666666667","tokensSold":"0","realCurveEth":"0","protocolFees":"0","creatorFees":"0"},"input":{"ethGross":"0","tokensIn":"1"},"output":null,"nextState":{"phase":"curve","virtualEth":"1400000000000000000","virtualToken":"1066666666666666666666666667","tokensSold":"0","realCurveEth":"0","protocolFees":"0","creatorFees":"0"},"expectedRevert":{"name":"Oversell","data":"0x7062590400000000000000000000000000000000000000000000000000000000000000010000000000000000000000000000000000000000000000000000000000000000"}},{"id":"invalid_sell_one_wei_zero_output","operation":"sell","initialState":{"phase":"curve","virtualEth":"2390000000000000000","virtualToken":"624825662482566248256624826","tokensSold":"441841004184100418410041841","realCurveEth":"990000000000000000","protocolFees":"5000000000000000","creatorFees":"5000000000000000"},"input":{"ethGross":"0","tokensIn":"1"},"output":null,"nextState":{"phase":"curve","virtualEth":"2390000000000000000","virtualToken":"624825662482566248256624826","tokensSold":"441841004184100418410041841","realCurveEth":"990000000000000000","protocolFees":"5000000000000000","creatorFees":"5000000000000000"},"expectedRevert":{"name":"ZeroOutput","data":"0xe618637e"}}]}
